mysql> create database PayrollService;
Query OK, 1 row affected (0.05 sec)

mysql> show databases;
+--------------------+
| Database           |
+--------------------+
| addressbookservice |
| information_schema |
| mysql              |
| payrollservice     |
| performance_schema |
| sakila             |
| sys                |
| world              |
+--------------------+
8 rows in set (0.00 sec)

mysql> use PayrollService database;
Database changed

mysql> show tables;
Empty set (0.07 sec)

mysql> select database();
+----------------+
| database()     |
+----------------+
| payrollservice |
+----------------+
1 row in set (0.00 sec)

mysql> create table employee_payroll(ID INT unsigned NOT NULL AUTO_INCREMENT, Name varchar(250) NOT NU
LL, Salary double NOT NULL, Start_Date DATE NOT NULL, PRIMARY KEY(ID));
Query OK, 0 rows affected (0.17 sec)

mysql> describe employee_payroll;
+------------+--------------+------+-----+---------+----------------+
| Field      | Type         | Null | Key | Default | Extra          |
+------------+--------------+------+-----+---------+----------------+
| ID         | int unsigned | NO   | PRI | NULL    | auto_increment |
| Name       | varchar(250) | NO   |     | NULL    |                |
| Salary     | double       | NO   |     | NULL    |                |
| Start_Date | date         | NO   |     | NULL    |                |
+------------+--------------+------+-----+---------+----------------+
4 rows in set (0.06 sec)

mysql> INSERT INTO employee_payroll (Name, Salary, Start_Date) VALUES ("John", 500000.00, '2020-01-10'), ("Daniels", 600000.00, '2021-02-15'), ("Raj", 400000.00, '2019-05-02');
Query OK, 3 rows affected (1.99 sec)
Records: 3  Duplicates: 0  Warnings: 0

mysql> select * from employee_payroll;
+----+---------+--------+------------+
| ID | Name    | Salary | Start_Date |
+----+---------+--------+------------+
|  1 | John    | 500000 | 2020-01-10 |
|  2 | Daniels | 600000 | 2021-02-15 |
|  3 | Raj     | 400000 | 2019-05-02 |
+----+---------+--------+------------+
3 rows in set (0.00 sec)

mysql> select * FROM employee_payroll WHERE Start_Date BETWEEN CAST('2020-01-10' AS DATE) AND DATE(NOW());
+----+---------+--------+------------+
| ID | Name    | Salary | Start_Date |
+----+---------+--------+------------+
|  1 | John    | 500000 | 2020-01-10 |
|  2 | Daniels | 600000 | 2021-02-15 |
+----+---------+--------+------------+
2 rows in set (0.02 sec)

mysql> ALTER TABLE employee_payroll ADD Gender CHAR(1) AFTER Name;
Query OK, 0 rows affected (0.11 sec)
Records: 0  Duplicates: 0  Warnings: 0

mysql> UPDATE employee_payroll set Gender = 'M' WHERE Name = "John";
Query OK, 1 row affected (0.04 sec)
Rows matched: 1  Changed: 1  Warnings: 0

mysql> UPDATE employee_payroll set Gender = 'M' WHERE Name = 'Daniels' or Name = 'Raj';
Query OK, 2 rows affected (0.05 sec)
Rows matched: 2  Changed: 2  Warnings: 0

mysql> select * FROM employee_payroll;
+----+---------+--------+--------+------------+
| ID | Name    | Gender | Salary | Start_Date |
+----+---------+--------+--------+------------+
|  1 | John    | M      | 500000 | 2020-01-10 |
|  2 | Daniels | M      | 600000 | 2021-02-15 |
|  3 | Raj     | M      | 400000 | 2019-05-02 |
+----+---------+--------+--------+------------+
3 rows in set (0.00 sec)

mysql> INSERT INTO employee_payroll(Name,Gender,Salary,Start_Date) VALUES ("Priya",'F',500000,'2020-05-10');
Query OK, 1 row affected (0.20 sec)

mysql> INSERT INTO employee_payroll(Name,Gender,Salary,Start_Date) VALUES ("Prema",'F',600000,'2021-04-05');
Query OK, 1 row affected (0.06 sec)

mysql> select * from employee_payroll;
+----+---------+--------+--------+------------+
| ID | Name    | Gender | Salary | Start_Date |
+----+---------+--------+--------+------------+
|  1 | John    | M      | 500000 | 2020-01-10 |
|  2 | Daniels | M      | 600000 | 2021-02-15 |
|  3 | Raj     | M      | 400000 | 2019-05-02 |
|  4 | Priya   | F      | 500000 | 2020-05-10 |
|  5 | Prema   | F      | 600000 | 2021-04-05 |
+----+---------+--------+--------+------------+
5 rows in set (0.00 sec)

mysql> SELECT SUM(Salary) FROM employee_payroll;
+-------------+
| SUM(Salary) |
+-------------+
|     2600000 |
+-------------+
1 row in set (0.03 sec)

mysql> SELECT AVG(Salary) FROM employee_payroll;
+-------------+
| AVG(Salary) |
+-------------+
|      520000 |
+-------------+
1 row in set (0.00 sec)

mysql> SELECT COUNT(ID) FROM employee_payroll WHERE (Gender = 'M');
+-----------+
| COUNT(ID) |
+-----------+
|         3 |
+-----------+
1 row in set (0.01 sec)

mysql> SELECT COUNT(ID) FROM employee_payroll WHERE (Gender = 'F');
+-----------+
| COUNT(ID) |
+-----------+
|         2 |
+-----------+
1 row in set (0.00 sec)

mysql> SELECT MIN(Salary) FROM employee_payroll;
+-------------+
| MIN(Salary) |
+-------------+
|      400000 |
+-------------+
1 row in set (0.02 sec)

mysql> SELECT MAX(Salary) FROM employee_payroll;
+-------------+
| MAX(Salary) |
+-------------+
|      600000 |
+-------------+
1 row in set (0.00 sec)

mysql> SELECT SUM(Salary) FROM employee_payroll WHERE(Gender = 'M');
+-------------+
| SUM(Salary) |
+-------------+
|     1500000 |
+-------------+
1 row in set (0.00 sec)

mysql> SELECT SUM(Salary) FROM employee_payroll WHERE(Gender = 'F');
+-------------+
| SUM(Salary) |
+-------------+
|     1100000 |
+-------------+
1 row in set (0.00 sec)

Query OK, 0 rows affected (0.05 sec)
Records: 0  Duplicates: 0  Warnings: 0

mysql> alter table employee_payroll add Address varchar(255) after Department;
Query OK, 0 rows affected (0.04 sec)
Records: 0  Duplicates: 0  Warnings: 0

mysql> alter table employee_payroll add PhoneNumber BIGINT(255) after Address;
Query OK, 0 rows affected, 1 warning (0.04 sec)
Records: 0  Duplicates: 0  Warnings: 1

mysql> select * from employee_payroll;
+----+---------+--------+--------+------------+------------+---------+-------------+
| ID | Name    | Gender | Salary | Start_Date | Department | Address | PhoneNumber |
+----+---------+--------+--------+------------+------------+---------+-------------+
|  1 | John    | M      | 500000 | 2020-01-10 | NULL       | NULL    |        NULL |
|  2 | Daniels | M      | 600000 | 2021-02-15 | NULL       | NULL    |        NULL |
|  3 | Raj     | M      | 400000 | 2019-05-02 | NULL       | NULL    |        NULL |
|  4 | Priya   | F      | 500000 | 2020-05-10 | NULL       | NULL    |        NULL |
|  5 | Prema   | F      | 600000 | 2021-04-05 | NULL       | NULL    |        NULL |
+----+---------+--------+--------+------------+------------+---------+-------------+
5 rows in set (0.00 sec)

mysql> update employee_payroll set Department = 'Marketing', Address = 'Bangalore', PhoneNumber = 9865472104;
Query OK, 5 rows affected (0.03 sec)
Rows matched: 5  Changed: 5  Warnings: 0

mysql> update employee_payroll set Department = 'HR', Address = 'Mumbai', PhoneNumber = 9854521047 where ID = 2;
Query OK, 1 row affected (0.06 sec)
Rows matched: 1  Changed: 1  Warnings: 0

mysql> update employee_payroll set Department = 'Sales', Address = 'Chennai', PhoneNumber = 8756421045 where ID = 3;
Query OK, 1 row affected (0.02 sec)
Rows matched: 1  Changed: 1  Warnings: 0

mysql> update employee_payroll set Department = 'Marketing', Address = 'Vizag', PhoneNumber = 8653201456 where ID = 4;
Query OK, 1 row affected (0.02 sec)
Rows matched: 1  Changed: 1  Warnings: 0

mysql> update employee_payroll set Department = 'HR', Address = 'Hyderabad', PhoneNumber = 9658320145 where ID = 5;
Query OK, 1 row affected (0.03 sec)
Rows matched: 1  Changed: 1  Warnings: 0

mysql> select * from employee_payroll;
+----+---------+--------+--------+------------+------------+-----------+-------------+
| ID | Name    | Gender | Salary | Start_Date | Department | Address   | PhoneNumber |
+----+---------+--------+--------+------------+------------+-----------+-------------+
|  1 | John    | M      | 500000 | 2020-01-10 | Marketing  | Bangalore |  9865472104 |
|  2 | Daniels | M      | 600000 | 2021-02-15 | HR         | Mumbai    |  9854521047 |
|  3 | Raj     | M      | 400000 | 2019-05-02 | Sales      | Chennai   |  8756421045 |
|  4 | Priya   | F      | 500000 | 2020-05-10 | Marketing  | Vizag     |  8653201456 |
|  5 | Prema   | F      | 600000 | 2021-04-05 | HR         | Hyderabad |  9658320145 |
+----+---------+--------+--------+------------+------------+-----------+-------------+
5 rows in set (0.00 sec)

mysql> alter table employee_payroll add Basic_Pay INT after PhoneNumber;
Query OK, 0 rows affected (0.04 sec)
Records: 0  Duplicates: 0  Warnings: 0

mysql> alter table employee_payroll add Deductions INT after Basic_Pay;
Query OK, 0 rows affected (0.05 sec)
Records: 0  Duplicates: 0  Warnings: 0

mysql> alter table employee_payroll add Taxable_Pay INT after Deductions;
Query OK, 0 rows affected (0.04 sec)
Records: 0  Duplicates: 0  Warnings: 0

mysql> alter table employee_payroll add Income_Tax INT after Taxable_Pay;
Query OK, 0 rows affected (0.06 sec)
Records: 0  Duplicates: 0  Warnings: 0

mysql> alter table employee_payroll add NeT_Pay INT after Income_Tax;
Query OK, 0 rows affected (0.04 sec)
Records: 0  Duplicates: 0  Warnings: 0

mysql> update employee_payroll set Basic_Pay = 50000, Deductions = 5000, Taxable_Pay = 3000, Income_Tax = 2000, NeT_Pay = 40000 where ID = 1;
Query OK, 1 row affected (0.05 sec)
Rows matched: 1  Changed: 1  Warnings: 0

mysql> update employee_payroll set Basic_Pay = 39000, Deductions = 3000, Taxable_Pay = 2000, Income_Tax = 1000, NeT_Pay = 30000 where ID = 2;
Query OK, 1 row affected (0.04 sec)
Rows matched: 1  Changed: 1  Warnings: 0

mysql> update employee_payroll set Basic_Pay = 60000, Deductions = 5000, Taxable_Pay = 5000, Income_Tax = 5000, NeT_Pay = 45000 where ID = 3;
Query OK, 1 row affected (0.02 sec)
Rows matched: 1  Changed: 1  Warnings: 0

mysql> update employee_payroll set Basic_Pay = 50000, Deductions = 5000, Taxable_Pay = 5000, Income_Tax = 5000, NeT_Pay = 35000 where ID = 4;
Query OK, 1 row affected (0.03 sec)
Rows matched: 1  Changed: 1  Warnings: 0

mysql> update employee_payroll set Basic_Pay = 64000, Deductions = 4000, Taxable_Pay = 4000, Income_Tax = 6000, NeT_Pay = 50000 where ID = 5;
Query OK, 1 row affected (0.07 sec)
Rows matched: 1  Changed: 1  Warnings: 0

mysql> select * from employee_payroll;
+----+---------+--------+--------+------------+------------+-----------+-------------+-----------+------------+-------------+------------+---------+
| ID | Name    | Gender | Salary | Start_Date | Department | Address   | PhoneNumber | Basic_Pay | Deductions | Taxable_Pay | Income_Tax | NeT_Pay |
+----+---------+--------+--------+------------+------------+-----------+-------------+-----------+------------+-------------+------------+---------+
|  1 | John    | M      | 500000 | 2020-01-10 | Marketing  | Bangalore |  9865472104 |     50000 |       5000 |        3000 |       2000 |   40000 |
|  2 | Daniels | M      | 600000 | 2021-02-15 | HR         | Mumbai    |  9854521047 |     39000 |       3000 |        2000 |       1000 |   30000 |
|  3 | Raj     | M      | 400000 | 2019-05-02 | Sales      | Chennai   |  8756421045 |     60000 |       5000 |        5000 |       5000 |   45000 |
|  4 | Priya   | F      | 500000 | 2020-05-10 | Marketing  | Vizag     |  8653201456 |     50000 |       5000 |        5000 |       5000 |   35000 |
|  5 | Prema   | F      | 600000 | 2021-04-05 | HR         | Hyderabad |  9658320145 |     64000 |       4000 |        4000 |       6000 |   50000 |
+----+---------+--------+--------+------------+------------+-----------+-------------+-----------+------------+-------------+------------+---------+
5 rows in set (0.00 sec)

mysql> insert into employee_payroll (ID, Name, Gender, Salary, Start_Date, Department, Address, PhoneNumber, Basic_Pay, Deductions, Taxable_Pay, Income_Tax, NeT_Pay) values(6, 'Terissa', 'F', 650000, '2021-05-05', 'Sales', 'Bangalore', 7895462015, '50000', 5000, 5000, 3000, 45000) ;
Query OK, 1 row affected (0.04 sec)

mysql> update employee_payroll set Name = 'Terissa' where ID = 4;
Query OK, 1 rows affected (0.04 sec)

mysql> select * from employee_Payroll;
+----+---------+--------+--------+------------+------------+-----------+-------------+-----------+------------+-------------+------------+---------+
| ID | Name    | Gender | Salary | Start_Date | Department | Address   | PhoneNumber | Basic_Pay | Deductions | Taxable_Pay | Income_Tax | NeT_Pay |
+----+---------+--------+--------+------------+------------+-----------+-------------+-----------+------------+-------------+------------+---------+
|  1 | John    | M      | 500000 | 2020-01-10 | Marketing  | Bangalore |  9865472104 |     50000 |       5000 |        3000 |       2000 |   40000 |
|  2 | Daniel  | M      | 600000 | 2021-02-15 | HR         | Mumbai    |  9854521047 |     39000 |       3000 |        2000 |       1000 |   30000 |
|  3 | Raj     | M      | 400000 | 2019-05-02 | Sales      | Chennai   |  8756421045 |     60000 |       5000 |        5000 |       5000 |   45000 |
|  4 | Terissa | F      | 500000 | 2020-05-10 | Marketing  | Vizag     |  8653201456 |     50000 |       5000 |        5000 |       5000 |   35000 |
|  5 | Prema   | F      | 600000 | 2021-04-05 | HR         | Hyderabad |  9658320145 |     64000 |       4000 |        4000 |       6000 |   50000 |
|  6 | Terissa | F      | 650000 | 2021-05-05 | Sales      | Bangalore |  7895462015 |     50000 |       5000 |        5000 |       3000 |   45000 |
+----+---------+--------+--------+------------+------------+-----------+-------------+-----------+------------+-------------+------------+---------+
6 rows in set (0.00 sec)
Rows matched: 6  Changed: 5  Warnings: 0

mysql> select sum(salary) from employee_payroll where gender = 'M' GROUP BY gender;
+-------------+
| sum(salary) |
+-------------+
|     1500000 |
+-------------+
1 row in set (0.01 sec)

mysql> select sum(salary) from employee_payroll where gender = 'F' GROUP BY gender;
+-------------+
| sum(salary) |
+-------------+
|     1750000 |
+-------------+
1 row in set (0.00 sec)

mysql> select avg(Salary) from employee_payroll where gender = 'M' GROUP BY gender;
+-------------+
| avg(Salary) |
+-------------+
|      500000 |
+-------------+
1 row in set (0.01 sec)

mysql> select avg(Salary) from employee_payroll where gender = 'F' GROUP BY gender;
+-------------------+
| avg(Salary)       |
+-------------------+
| 583333.3333333334 |
+-------------------+
1 row in set (0.00 sec)

mysql> select min(Salary) from employee_payroll where gender = 'M' GROUP BY gender;
+-------------+
| min(Salary) |
+-------------+
|      400000 |
+-------------+
1 row in set (0.01 sec)

mysql> select min(Salary) from employee_payroll where gender = 'F' GROUP BY gender;
+-------------+
| min(Salary) |
+-------------+
|      500000 |
+-------------+
1 row in set (0.00 sec)

mysql> select max(Salary) from employee_payroll where gender = 'M' GROUP BY gender;
+-------------+
| max(Salary) |
+-------------+
|      600000 |
+-------------+
1 row in set (0.00 sec)

mysql> select max(Salary) from employee_payroll where gender = 'F' GROUP BY gender;
+-------------+
| max(Salary) |
+-------------+
|      650000 |
+-------------+
1 row in set (0.00 sec)

mysql> select count(Salary) from employee_payroll where gender = 'M' GROUP BY gender;
+---------------+
| count(Salary) |
+---------------+
|             3 |
+---------------+
1 row in set (0.00 sec)

mysql> select count(Salary) from employee_payroll where gender = 'F' GROUP BY gender;
+---------------+
| count(Salary) |
+---------------+
|             3 |
+---------------+
1 row in set (0.00 sec)

mysql> insert into employee_department (Employee_ID, Department_ID, employee_payroll_ID) values(1,10,1);
Query OK, 1 row affected (0.04 sec)

mysql> insert into employee_department (Department_ID, employee_payroll_ID) values(20,2);
Query OK, 1 row affected (0.04 sec)

mysql> insert into employee_department (Department_ID, employee_payroll_ID) values(30,3);
Query OK, 1 row affected (0.06 sec)

mysql> insert into employee_department (Department_ID, employee_payroll_ID) values(10,4);
Query OK, 1 row affected (0.05 sec)

mysql> insert into employee_department (Department_ID, employee_payroll_ID) values(20,5);
Query OK, 1 row affected (0.04 sec)

mysql> insert into employee_department (Department_ID, employee_payroll_ID) values(30,6);
Query OK, 1 row affected (0.04 sec)

mysql> select * from employee_department;
+-------------+---------------+---------------------+
| Employee_ID | Department_ID | employee_payroll_ID |
+-------------+---------------+---------------------+
|           1 | 10            |                   1 |
|           2 | 20            |                   2 |
|           3 | 30            |                   3 |
|           4 | 10            |                   4 |
|           5 | 20            |                   5 |
|           6 | 30            |                   6 |
+-------------+---------------+---------------------+
6 rows in set (0.00 sec)